{
  "product_or_offer": "washed linen table textile",
  "target_market": "Germany",
  "customer_type": "brand",
  "search_keywords": [
    "table linen brand",
    "home textile collections"
  ],
  "must_include": [
    "design"
  ],
  "exclude_terms": [
    "job"
  ],
  "max_results": 4,
  "notes": "Prefer design-led brands.",
  "fixtures_json": "/Users/evenbetter/Downloads/半斤九两/Obsidian Vault/工具工作间/01_在整理的Skill/外贸skill源文件/客户搜索skill/examples/textile-fixtures.json"
}
